{
  "schema": "ip-profile/v1",
  "ownership": {
    "status": "licensed",
    "basis": "Original fictional tutorial character and SVG created by repository contributors and licensed for reuse with this repository; see LICENSE and NOTICE."
  },
  "identity": {
    "name": "Mira",
    "description": "A fictional adult workshop guide who makes abstract ideas visible with simple paper models."
  },
  "appearance": {
    "description": "Human adult with short side-swept dark hair, round clear glasses, an ochre overshirt and a small green notebook.",
    "signature_features": [
      "short side-swept dark hair",
      "round clear glasses",
      "ochre overshirt",
      "small green notebook"
    ]
  },
  "personality": {
    "traits": [
      "curious",
      "patient",
      "practical"
    ]
  },
  "continuity_anchors": [
    "adult proportions",
    "short side-swept dark hair",
    "round clear glasses",
    "ochre overshirt",
    "green notebook"
  ],
  "references": []
}
